{
  "$schema": "https://json-schema.org/draft/2020-12/schema",
  "$id": "ai-os://prompt-compiler/profile.schema.json",
  "title": "ModelExecutionProfile",
  "type": "object",
  "additionalProperties": false,
  "required": [
    "id",
    "display_name",
    "role_style",
    "context_limit_policy",
    "task_decomposition",
    "expected_output_format",
    "verbosity_limit",
    "tool_use_guidance"
  ],
  "properties": {
    "id": { "type": "string" },
    "display_name": { "type": "string" },
    "role_style": { "type": "string" },
    "context_limit_policy": { "type": "object" },
    "context_budget": {
      "type": "object",
      "description": "Optional V1.4 context optimizer budget. Overrides defaults. preferred_max_files = soft target for optional refs (required never dropped); hard_max_files = absolute cap on total selected refs (required kept even above it, with a warning).",
      "properties": {
        "max_files": { "type": "integer", "minimum": 1 },
        "preferred_max_files": { "type": "integer", "minimum": 1 },
        "hard_max_files": { "type": "integer", "minimum": 1 },
        "max_tokens": { "type": "integer", "minimum": 0 }
      },
      "additionalProperties": false
    },
    "task_decomposition": { "type": "string" },
    "expected_output_format": { "type": "string" },
    "verbosity_limit": { "type": "string" },
    "tool_use_guidance": { "type": "string" }
  }
}
